snp,x,y,p_values,odds_ratios,phenotypes,cluster
B_5701,0,4,"[0.02245, 0.01388, 0.04792, 0.01042, 0.03329, 0.04203, 0.03577, 0.008923, 0.004412, 0.04179, 0.01731, 0.04374, 0.0003553, 0.04776, 0.04442, 0.00692, 0.002452, 0.03289, 0.009642, 0.02168, 0.01941, 0.01112, 0.01976, 0.03364, 0.004006, 0.004205, 0.03196, 0.01017, 0.004512, 0.02693, 0.049, 0.0129, 0.01366, 0.03144, 0.0008078, 0.01281, 0.04588, 0.02626, 0.002835, 0.04995, 0.04158, 0.02178, 0.0148, 0.03923, 0.0367, 0.003871, 0.0308, 0.01616, 0.04121, 0.04638, 0.03935, 0.03166, 0.02791, 0.006891, 0.028, 0.04099, 0.02999, 0.03931, 0.04891, 0.0347, 0.02816, 0.0248, 0.03483, 0.0006992, 0.001093, 0.001404, 0.005121, 0.0006432, 0.01636, 0.03572, 0.02354, 0.03123, 0.01275, 0.01911, 0.01539, 0.0399, 0.03327]","[1.314, 1.511, 1.241, 1.921, 1.347, 1.151, 1.216, 1.381, 0.512, 0.582, 1.157, 0.628, 1.256, 1.465, 2.454, 1.514, 1.412, 0.484, 0.158, 0.81, 0.647, 0.277, 0.257, 0.812, 1.348, 1.414, 2.01, 1.89, 1.999, 1.595, 0.316, 0.429, 0.746, 1.322, 1.935, 1.328, 1.29, 1.24, 1.332, 1.233, 1.315, 1.323, 1.254, 1.303, 1.651, 1.627, 1.508, 1.213, 1.729, 0.774, 0.744, 0.693, 0.665, 0.354, 2.49, 1.848, 1.87, 0.638, 0.617, 0.587, 1.343, 1.543, 1.513, 1.718, 1.704, 1.78, 2.044, 3.604, 0.746, 0.749, 2.574, 2.09, 2.053, 0.734, 2.3, 1.596, 1.94]","['Postoperative infection', 'Hx of malignant neoplasm of oral cavity and pharynx', 'Melanomas of skin, dx or hx', 'Cancer of other female genital organs', 'Radiotherapy', 'Secondary malignant neoplasm', 'Secondary malignancy of lymph nodes', 'Secondary malignancy of bone', 'Myeloproliferative disease', 'Nontoxic uninodular goiter', 'Diabetes mellitus', 'Type 1 diabetes', 'Type 2 diabetes', 'Type 2 diabetes with ophthalmic manifestations', 'Delay in sexual development and puberty NEC', 'Anorexia', 'Morbid obesity', 'Other immunological findings', 'Acquired hemolytic anemias', 'Encounter for long-term (current) use of anticoagulants', 'Other and unspecified coagulation defects', 'Hypercoagulable state', 'Primary hypercoagulable state', 'Purpura and other hemorrhagic conditions', 'Lymphadenitis', 'Swelling, mass, or lump in head and neck [Space-occupying lesion, intracranial NOS]', 'Somatoform disorder', 'Mental retardation', 'Cerebral degeneration, unspecified', 'Essential tremor', 'Anterior horn cell disease', 'Multiple sclerosis', 'Other peripheral nerve disorders', 'Degeneration of macula and posterior pole of retina', 'Macular degeneration (senile) of retina NOS', 'Other disorders of eye', 'Disorders of vitreous body', 'Sensorineural hearing loss', 'Other specified cardiac dysrhythmias', 'Occlusion and stenosis of precerebral arteries', 'Other aneurysm', 'Peripheral vascular disease, unspecified', 'Acute sinusitis', 'Septal Deviations/Turbinate Hypertrophy', 'Bronchitis', 'Pneumonitis due to inhalation of food or vomitus', 'Stricture and stenosis of esophagus', 'Dysphagia', 'Intestinal malabsorption (non-celiac)', 'Chronic liver disease and cirrhosis', 'Other chronic nonalcoholic liver disease', 'Cirrhosis of liver without mention of alcohol', 'Other biliary tract disease', 'Splenomegaly', 'Chronic cystitis', 'Bladder neck obstruction', 'Urethral stricture (not specified as infectious)', 'Genital prolapse', 'Prolapse of vaginal walls', 'Known or suspected fetal abnormality affecting management of mother', 'Cellulitis and abscess of leg, except foot', 'Erythematosquamous dermatosis', 'Seborrheic dermatitis', 'Psoriasis and related disorders', 'Psoriasis', 'Psoriasis vulgaris', 'Psoriatic arthropathy', 'Hirsutism', 'Rheumatoid arthritis and other inflammatory polyarthropathies', 'Rheumatoid arthritis', 'Rupture of synovium', 'Disorders of muscle, ligament, and fascia', 'Kyphosis (acquired)', 'Osteoarthrosis, localized, primary', 'Hypothermia/Chills', 'Other open wound of head and face', 'Poisoning by water, mineral, and uric acid metabolism drugs']",2
C_0701,2,8,"[0.02027, 0.03447, 0.04287, 0.01536, 0.04744, 0.03356, 0.03967, 0.0377, 0.03932, 0.04649, 0.008477, 0.00245, 0.0132, 1.358e-07, 0.000133, 0.03204, 0.01238, 0.03155, 0.001372, 0.01395, 0.04474, 0.04553, 0.007826, 0.0194, 0.03577, 0.03347, 0.02845, 0.01152, 0.02411, 0.04242, 0.04992, 0.03895, 0.03753, 0.001989, 0.01392, 0.01979, 0.04469, 0.04949, 0.04348, 0.03531, 0.03877, 0.02807, 0.01932, 0.003477, 0.02036, 0.00685, 0.004016, 0.01438, 0.04245, 0.005408, 0.008182, 0.02998, 0.0356, 0.03733, 0.03362, 0.0003166, 0.04356, 0.004774, 0.006721, 0.008261, 0.01964, 0.04784, 0.03121, 0.002371, 4.388e-05, 0.001569, 0.0308, 0.03507, 0.02094, 0.01463, 0.0005352, 0.0008051, 1.616e-08, 2.592e-06, 0.0007912, 0.0002193, 0.005115, 0.02512, 0.0427, 0.005613, 0.01895, 0.03532, 0.02674, 0.0139, 0.04871, 0.02953]","[0.815, 0.804, 0.806, 1.71, 1.628, 0.657, 0.809, 0.632, 1.317, 0.565, 1.11, 1.136, 1.468, 1.665, 2.302, 1.655, 1.19, 0.874, 1.406, 1.411, 1.255, 1.256, 0.72, 1.888, 1.15, 1.155, 0.844, 0.754, 1.757, 0.793, 0.577, 0.57, 1.317, 1.318, 1.528, 1.204, 1.333, 0.781, 0.87, 0.899, 1.289, 0.699, 1.166, 1.291, 0.448, 1.195, 0.781, 0.516, 1.211, 1.992, 1.966, 0.537, 0.575, 0.756, 0.836, 2.281, 0.871, 1.197, 1.208, 1.236, 1.31, 1.541, 1.181, 1.293, 1.735, 1.517, 1.213, 1.173, 0.466, 1.173, 1.41, 1.409, 1.584, 2.165, 2.189, 1.981, 0.298, 0.703, 0.834, 1.904, 0.613, 0.461, 1.548, 1.319, 1.42, 0.829]","['Intestinal infection', 'Bacterial enteritis', 'Intestinal infection due to C. difficile', 'Dermatophytosis of the body', 'Histoplasmosis', 'Cervical cancer', 'Secondary malignant neoplasm of digestive systems', 'Vascular hamartomas and non-neoplastic nevi', ""Graves' disease"", 'Toxic multinodular goiter', 'Hypothyroidism', 'Hypothyroidism NOS', 'Thyroiditis', 'Type 1 diabetes', 'Type 1 diabetes with ketoacidosis', 'Type 1 diabetes with ophthalmic manifestations', 'Insulin pump user', 'Abnormal glucose', 'Diabetic retinopathy', 'Hypoglycemia', 'Testicular dysfunction', 'Testicular hypofunction', 'Failure to thrive (childhood)', 'Disturbances of amino-acid transport', 'Gout and other crystal arthropathies', 'Gout', 'Disorders of calcium/phosphorus metabolism', 'Disorders of phosphorus metabolism', 'Autoimmune hemolytic anemias', 'Secondary thrombocytopenia', 'Schizophrenia', 'Somatoform disorder', 'Sleep related movement disorders', 'Extrapyramidal disease and abnormal movement disorders', 'Torsion dystonia', 'Degeneration of macula and posterior pole of retina', 'Macular degeneration, dry', 'Primary open angle glaucoma', 'Nonrheumatic aortic valve disorders', 'Tachycardia NOS', 'Abnormal function study of cardiovascular system', 'Intracerebral hemorrhage', 'Atherosclerosis', 'Atherosclerosis of the extremities', 'Acute vascular insufficiency of intestine', 'Peripheral vascular disease', 'Acute pharyngitis', 'Acute laryngitis and tracheitis', 'Diseases of hard tissues of teeth', 'Diseases of pulp and periapical tissues', 'Periapical abscess', 'Disorders of esophageal motility', 'Heartburn', 'Dyspepsia and other specified disorders of function of stomach', 'Diaphragmatic hernia', 'Celiac disease', 'Intestinal obstruction without mention of hernia', 'Chronic liver disease and cirrhosis', 'Other chronic nonalcoholic liver disease', 'Cirrhosis of liver without mention of alcohol', 'Portal hypertension', 'Acute and subacute necrosis of liver', 'Abnormal results of function study of liver', 'Other biliary tract disease', 'Cholangitis', 'Obstruction of bile duct', 'Renal dialysis', 'End stage renal disease', 'Noninflammatory disorders of ovary, fallopian tube, and broad ligament', 'Disturbance of skin sensation', 'Lupus (localized and systemic)', 'Systemic lupus erythematosus', 'Diffuse diseases of connective tissue', 'Sicca syndrome', 'Polymyositis', 'Dermatomyositis', 'Ankylosing spondylitis', 'Hammer toe (acquired)', 'Cardiac shunt/ heart septal defect', 'Congenital anomalies of peripheral vascular system', 'Other congenital musculoskeletal anomalies', 'Pectus and other congenital anomalies of ribs/sternum', 'Abnormal posture', 'Fracture of foot', 'Fracture of clavicle or scapula', 'Dislocation']",2
C_1402,1,5,"[0.01515, 0.04219, 0.01716, 0.0393, 0.02202, 0.03033, 0.03935, 0.02328, 0.004691, 0.03455, 0.01937, 0.01107, 0.04602, 0.02649, 0.008153, 0.02473, 0.02764, 0.03641, 0.03995, 0.01536, 0.0151, 0.001066, 0.001497, 0.0308, 0.04267, 0.0453, 0.04141, 0.01069, 0.01541, 0.01405, 0.03238, 0.03028, 0.03181, 0.0008176, 0.0434, 0.04623, 0.0411, 0.02326, 0.02364, 0.03681, 0.006855, 0.02731, 0.04126, 0.02931, 0.02926, 0.03814, 0.025, 0.03586, 0.02907, 0.006518, 0.04104, 0.0233, 0.00158, 0.006391, 0.04501, 0.02629, 0.0139, 0.01116, 0.006544]","[3.547, 0.536, 0.374, 1.975, 2.042, 0.768, 0.765, 0.462, 1.9, 3.572, 1.909, 2.209, 0.689, 1.505, 1.679, 0.486, 0.277, 0.346, 0.231, 2.79, 1.885, 2.022, 2.532, 1.569, 0.459, 1.502, 1.58, 3.864, 0.57, 3.132, 0.608, 1.824, 1.311, 1.62, 3.367, 0.527, 0.129, 2.862, 1.915, 0.123, 2.247, 0.508, 1.586, 2.971, 0.551, 2.607, 1.908, 1.876, 2.119, 2.713, 0.233, 2.629, 2.995, 1.604, 1.992, 2.379, 2.655, 3.769, 4.165]","['Aspergillosis', 'Cancer of larynx, pharynx, nasal cavities', 'Cancer of larynx', 'Cervical intraepithelial neoplasia [CIN] [Cervical dysplasia]', 'Large cell lymphoma', 'Diabetes mellitus', 'Type 2 diabetes', 'Type 2 diabetes with neurological manifestations', 'Disorders of adrenal glands', 'Hyperaldosteronism', 'Adrenal hypofunction', 'Glucocorticoid deficiency', 'Vitamin deficiency', 'Acid-base balance disorder', 'Acidosis', 'Morbid obesity', 'Iron deficiency anemia secondary to blood loss (chronic)', 'Other deficiency anemia', 'Megaloblastic anemia', 'Transient alteration of awareness', 'Schizophrenia and other psychotic disorders', 'Extrapyramidal disease and abnormal movement disorders', 'Essential tremor', 'Myopia', 'Other disorders of eyelids', 'Otitis media', 'Suppurative and unspecified otitis media', 'Labyrinthitis', 'Myocardial infarction', 'Hypertrophic obstructive cardiomyopathy', 'Other specified cardiac dysrhythmias', 'Chronic tonsillitis and adenoiditis', 'Allergic rhinitis', 'Asthma', 'Respiratory arrest', 'Other symptoms of respiratory system', 'Painful respiration', 'Other diseases of respiratory system, NEC', 'Dyspepsia and other specified disorders of function of stomach', 'Abnormal serum enzyme levels', 'Cholecystitis without cholelithiasis', 'Other symptoms involving abdomen and pelvis', 'Other abnormality of urination', 'Hematological disorders of newborn', 'Disturbance of skin sensation', 'Congenital anomalies of skin', 'Dyschromia and Vitiligo', 'Other dyschromia', 'Arthropathy associated with infections', 'Pyogenic arthritis', 'Valvular heart disease/ heart chambers', 'Other specified congenital anomalies of kidney', 'Symptoms of the muscles', 'Sprains and strains', 'Joint/ligament sprain', 'Injuries to the nervous system', 'Allergic reaction to food', 'Poisoning by agents primarily affecting blood constituents', 'Anticoagulants causing adverse effects']",2
DPB1_0401,0,7,"[0.008945, 0.01716, 0.01314, 0.03426, 0.01154, 0.01803, 0.03567, 0.03963, 0.03292, 0.01683, 0.02591, 0.005636, 0.01768, 0.02454, 0.04975, 0.04669, 0.04912, 0.003299, 0.04246, 0.02639, 0.04177, 0.0214, 0.03759, 0.0192, 0.03426, 0.03763, 0.03755, 0.01496, 0.04077, 0.04579, 0.03081, 0.03777, 0.0003728, 0.002051, 0.02743, 0.03588, 0.03051, 0.007357, 0.00842, 0.01413, 0.01353, 0.02587, 0.01871, 0.01982, 0.03778, 0.01371, 0.01207, 0.002741]","[0.616, 0.905, 0.811, 0.808, 1.859, 1.901, 1.224, 1.306, 1.94, 0.551, 0.595, 3.104, 0.51, 0.82, 1.226, 1.467, 1.211, 0.648, 0.581, 0.584, 0.72, 2.091, 0.842, 1.262, 0.868, 0.765, 0.865, 1.753, 1.163, 0.764, 0.778, 1.199, 0.621, 0.793, 1.796, 1.163, 1.189, 0.754, 1.194, 1.678, 0.557, 2.043, 1.51, 1.58, 0.687, 1.919, 0.82, 0.579]","['Viral Enteritis', 'Bacterial infection NOS', 'E. coli', 'Infection with drug-resistant microorganisms', ""Althete's foot"", 'Dermatophytosis of the body', 'Cancer of brain', 'Multiple myeloma', 'Benign neoplasm of eye, uveal', 'Benign neoplasm of thyroid glands', 'Type 1 diabetes with ophthalmic manifestations', 'Precocious sexual development and puberty NEC', 'Acquired coagulation factor deficiency', 'Dysthymic disorder', 'Alcohol-related disorders', 'Alcoholic liver damage', 'Myopathy', 'Corneal opacity and other disorders of cornea', ""Fuchs' dystrophy"", 'Eye infection, viral', 'Uveitis, noninfectious or NOS', 'Scleritis and episcleritis', 'Suppurative and unspecified otitis media', 'Heart valve replaced', 'Other forms of chronic heart disease', 'ASCVD', 'Chronic pulmonary heart disease', ""Wegener's granulomatosis"", 'Hemorrhoids', 'Influenza', 'Esophageal bleeding (varices/hemorrhage)', 'Other intestinal obstruction', 'Primary biliary cirrhosis', 'Abnormal results of function study of liver', 'Proliferative glomerulonephritis', 'Urinary calculus', 'Calculus of kidney', 'Other local infections of skin and subcutaneous tissue', 'Disturbance of skin sensation', 'Psoriatic arthropathy', 'Disorders of muscle, ligament, and fascia', 'Other disorders of soft tissues', 'Aseptic necrosis of bone', 'Symptoms of the muscles', 'Nonspecific findings on examination of blood', ""Colles' fracture"", 'Open wounds of extremities', 'Insect bite']",2
DPB1_0402,0,5,"[0.01602, 0.04735, 0.01744, 0.02815, 0.04946, 0.03426, 0.004711, 8.053e-07, 0.005887, 0.04802, 0.03008, 0.002239, 0.02026, 0.01593, 0.02713, 0.03684, 0.02254, 0.03635, 0.04157, 0.02733, 0.03619, 0.02649, 0.003403, 0.006692, 0.02254, 0.03032, 0.008715, 0.01635, 0.02616, 0.04586, 0.02517, 0.04189, 0.02795, 0.01155, 0.02069, 0.005396, 0.03364, 0.001377, 0.01711, 0.02773, 0.0357, 0.03181, 0.04032, 0.04594, 0.02667, 0.01876, 0.0466, 0.03524, 0.01185, 0.03405, 0.0005946, 0.03585, 0.04159, 0.04145, 0.04596, 0.02451, 0.004137, 0.004784, 0.03724, 0.009788, 0.01502, 0.03125, 0.01131]","[0.611, 0.512, 1.278, 0.785, 0.641, 0.62, 0.891, 0.481, 0.337, 0.495, 0.713, 0.769, 0.769, 0.716, 0.315, 0.693, 0.827, 0.823, 0.532, 1.286, 0.476, 0.49, 0.289, 0.556, 0.808, 1.345, 2.232, 0.327, 0.796, 1.174, 1.376, 1.358, 0.73, 0.58, 0.371, 0.721, 0.651, 1.466, 0.329, 0.827, 0.828, 0.365, 1.62, 0.672, 0.266, 0.541, 0.828, 0.37, 1.874, 1.289, 0.826, 0.696, 0.618, 0.647, 1.926, 0.721, 1.369, 1.452, 1.545, 0.73, 0.832, 0.772, 2.226]","['Herpes simplex', 'Cancer of other endocrine glands', 'Secondary malignant neoplasm of digestive systems', 'Secondary malignancy of brain/spine', 'Benign neoplasm of lip, oral cavity, and pharynx', 'Acquired hypothyroidism', 'Diabetes mellitus', 'Type 1 diabetes', 'Type 1 diabetes with ketoacidosis', 'Type 1 diabetes with renal manifestations', 'Type 2 diabetes with ophthalmic manifestations', 'Insulin pump user', 'Polyneuropathy in diabetes', 'Diabetic retinopathy', 'Precocious sexual development and puberty NEC', 'Hyperosmolality and/or hypernatremia', 'Acid-base balance disorder', 'Acidosis', 'Congenital coagulation defects', 'Secondary thrombocytopenia', 'Schizophrenia', 'Suicidal ideation', 'Somatoform disorder', 'Conduct disorders', 'Migraine', 'Hemiplegia', 'Superficial keratitis', 'Scleritis and episcleritis', 'Impacted cerumen', 'Other hypertensive complications', 'Primary pulmonary hypertension', 'Cardiac arrest and ventricular fibrillation', 'Atherosclerosis of native arteries of the extremities with intermittent claudication', 'Other disorders of arteries and arterioles', 'Stricture of artery', 'Other disorders of circulatory system', 'Paralysis/spasm of vocal cords or larynx', 'Epistaxis or throat hemorrhage', 'Viral pneumonia', 'Empyema and pneumothorax', 'Other symptoms of respiratory system', 'Respiratory complications', 'Dentofacial anomalies, including malocclusion', 'Diseases of the salivary glands', 'Leukoplakia of oral mucosa', ""Barrett's esophagus"", 'Hemorrhage of gastrointestinal tract', 'Acute prostatitis', 'Benign neoplasm of breast', 'Prolapse of vaginal walls', 'Superficial cellulitis and abscess', 'Sarcoidosis', 'Corns and callosities', 'Chronic ulcer of unspecified site', 'Rupture of synovium', 'Congenital anomalies of great vessels', 'Congenital anomalies of urinary system', 'Cystic kidney disease', 'Other specified congenital anomalies of kidney', 'Thoracic or lumbosacral neuritis or radiculitis, unspecified', 'Myalgia and myositis unspecified', 'Abnormal Papanicolaou smear of cervix and cervical HPV', 'Toxic effect of venom']",2
DPB1_0601,1,8,"[0.03833, 0.02355, 0.005285, 0.01642, 0.008795, 0.04672, 0.0003959, 0.03372, 0.0007357, 0.03814, 0.04758, 0.02794, 0.009725, 0.04978, 0.04372, 0.03114, 0.009459, 0.04329, 0.02043, 0.03872, 0.03307, 0.02908, 0.02015, 0.04546, 0.04354, 0.00545, 0.04311, 0.04759, 0.04401, 0.02474, 0.01316, 0.04394, 0.004336, 0.03752, 0.01531, 0.03092, 0.007299, 0.04782, 0.035, 0.02977, 0.04392, 0.02431, 0.03227, 0.04442, 0.007404, 0.01863, 0.03123, 0.01286, 0.02268, 0.01298, 0.02881, 0.04536, 0.01177, 0.02707, 0.007673, 0.0001286, 0.01821, 0.02484, 0.002759, 0.01844]","[1.469, 1.533, 3.096, 1.286, 2.052, 0.365, 2.667, 1.902, 2.453, 1.499, 0.315, 0.429, 0.31, 0.701, 1.241, 1.547, 1.879, 1.401, 0.588, 0.689, 1.964, 2.826, 1.455, 1.48, 2.032, 1.458, 1.665, 1.494, 0.539, 1.927, 1.964, 2.235, 3.187, 1.166, 1.203, 0.729, 0.258, 0.676, 1.446, 0.374, 0.402, 0.422, 0.44, 0.403, 3.239, 3.083, 2.047, 1.355, 1.369, 1.51, 1.596, 2.23, 2.112, 2.453, 2.994, 1.701, 1.455, 2.644, 2.333, 1.987]","['Methicillin sensitive Staphylococcus aureus', 'Viral warts & HPV', 'Cancer of nasopharynx', 'Other non-epithelial cancer of skin', 'Carcinoma in situ of skin', 'Malignant neoplasm of ovary', 'Cancer of other female genital organs', 'Benign neoplasm of lip, oral cavity, and pharynx', 'Acquired hypothyroidism', 'Type 1 diabetes', 'Impaired fasting glucose', 'Testicular dysfunction', 'Testicular hypofunction', 'Hyperpotassemia', 'Diseases of white blood cells', 'Bipolar', 'Posttraumatic stress disorder', 'Substance addiction and disorders', 'Other conditions of brain, NOS', 'Hereditary and idiopathic peripheral neuropathy', 'Myasthenia gravis', 'Progressive myopia', 'Open-angle glaucoma', 'Inflammation of eyelids', ""Meniere's disease"", 'Other forms of chronic heart disease', 'Left bundle branch block', 'Heart transplant/surgery', 'Intracranial hemorrhage', 'Phlebitis and thrombophlebitis of lower extremities', 'Chronic obstructive asthma', 'Disorders of diaphragm', 'Respiratory complications', 'Esophagitis, GERD and related diseases', 'GERD', 'Diverticulosis and diverticulitis', 'Diverticulitis', 'Ascites (non malignant)', 'Hydronephrosis', 'Dyschromia and Vitiligo', 'Other dyschromia', 'Psoriasis and related disorders', 'Psoriasis', 'Psoriasis vulgaris', 'Circumscribed scleroderma', 'Abnormal granulation tissue', 'Dermatomyositis', 'Rheumatoid arthritis and other inflammatory polyarthropathies', 'Rheumatoid arthritis', 'Synovitis and tenosynovitis', 'Joint effusions', 'Obstructive genitourinary defect', 'Congenital anomalies of limbs', 'Other congenital anomalies of lower limb, including pelvic girdle', 'Congenital hip dysplasia and deformity', 'Open wounds of head; neck; and trunk', 'Open wounds of extremities', 'Open wound of foot except toe(s) alone', 'Injuries to the nervous system', 'Poisoning by hormones and synthetic substitutes']",2
DQA1_0501,3,7,"[0.03497, 0.03821, 0.02121, 0.03292, 0.02364, 0.01467, 0.02525, 2.313e-05, 4.501e-06, 5.74e-08, 0.001769, 1.603e-07, 0.03835, 0.04598, 0.01353, 7.543e-10, 0.004279, 0.006114, 0.0154, 0.04787, 0.03249, 0.009896, 0.0002855, 0.001179, 0.04038, 0.02391, 0.02374, 0.04295, 0.007663, 0.009603, 0.00917, 0.02931, 0.02475, 0.02686, 0.004293, 0.01707, 0.04859, 0.002826, 0.01082, 0.04637, 0.03603, 0.007553, 0.02469, 0.02015, 0.04396, 0.01249, 0.04366, 0.03116, 0.01566, 0.04854, 0.02018, 0.0055, 0.02498, 0.0005871, 0.02395, 0.00656, 0.04848, 0.002768, 2.164e-07, 0.005049, 0.0495, 0.04641, 0.005829, 0.02079, 0.04939, 0.01635, 0.02462, 0.02786, 0.01529, 0.001834, 0.02583, 0.02539, 0.02481, 0.04248, 0.04375, 0.005497, 0.01303, 0.005129, 0.02662, 0.008091, 1.567e-06, 9.703e-05, 0.01021, 0.00274, 0.02296, 0.005474, 0.03602, 0.02351, 0.005691, 0.04581, 0.04072, 0.006273, 0.04644, 0.02367, 0.04177, 0.03895, 0.02181, 0.03935, 0.00942]","[1.474, 0.592, 0.667, 0.833, 0.846, 1.979, 0.713, 1.486, 1.804, 1.221, 1.248, 1.229, 1.366, 1.306, 1.086, 1.803, 1.874, 1.889, 1.756, 1.591, 1.179, 1.348, 1.268, 1.394, 0.472, 0.56, 1.337, 1.146, 1.158, 1.176, 1.282, 1.398, 1.745, 1.068, 1.304, 0.479, 0.598, 0.47, 0.4, 0.735, 0.531, 0.832, 0.835, 0.768, 1.336, 1.204, 1.073, 1.082, 1.162, 1.128, 0.885, 0.892, 0.841, 0.864, 1.666, 1.933, 0.642, 0.591, 3.784, 1.163, 1.121, 1.19, 1.81, 1.275, 1.527, 1.501, 1.081, 1.23, 1.109, 1.22, 1.207, 1.224, 1.17, 1.191, 1.224, 1.71, 1.589, 1.308, 1.246, 1.395, 1.465, 1.904, 1.827, 1.74, 0.877, 0.834, 0.638, 0.708, 0.676, 0.482, 1.608, 0.598, 0.829, 1.698, 1.655, 1.751, 1.249, 0.792, 1.156]","['Viral Enteritis', 'Herpes zoster with nervous system complications', 'Cervical cancer', 'Cancer of brain and nervous system', 'Secondary malignancy of bone', 'Neurofibromatosis', 'Benign neoplasm of other endocrine glands and related structures', 'Thyrotoxicosis with or without goiter', ""Graves' disease"", 'Hypothyroidism', 'Secondary hypothyroidism', 'Hypothyroidism NOS', 'Thyroiditis', 'Other disorders of thyroid', 'Diabetes mellitus', 'Type 1 diabetes', 'Type 1 diabetes with ketoacidosis', 'Type 1 diabetes with renal manifestations', 'Type 1 diabetes with ophthalmic manifestations', 'Type 1 diabetes with neurological manifestations', 'Type 2 diabetes with renal manifestations', 'Type 2 diabetes with ophthalmic manifestations', 'Insulin pump user', 'Diabetic retinopathy', 'Delay in sexual development and puberty NEC', 'Cachexia', 'Hyperosmolality and/or hypernatremia', 'Fluid overload', 'Iron deficiency anemias', 'Iron deficiency anemias, unspecified or not due to blood loss', 'Iron deficiency anemia secondary to blood loss (chronic)', 'Acquired hemolytic anemias', 'Autoimmune hemolytic anemias', 'Other anemias', 'Anemia in chronic kidney disease', 'Hypersomnia', 'Organic or persistent insomnia', 'Disorders of the globe', 'Progressive myopia', 'Corneal opacity and other disorders of cornea', ""Fuchs' dystrophy"", 'Glaucoma', 'Open-angle glaucoma', 'Primary open angle glaucoma', 'Ptosis of eyelid', 'Abnormal heart sounds', 'Ischemic Heart Disease', 'Coronary atherosclerosis', 'Other chronic ischemic heart disease, unspecified', 'Occlusion and stenosis of precerebral arteries', 'Acute sinusitis', 'Acute upper respiratory infections of multiple or unspecified sites', 'Acute pharyngitis', 'Allergic rhinitis', 'Jaw disease NOS', 'Ulcer of esophagus', 'Heartburn', 'Other specified gastritis', 'Celiac disease', 'Diverticulosis and diverticulitis', 'Diverticulosis', 'Other disorders of liver', 'Acute and subacute necrosis of liver', 'Jaundice (not of newborn)', 'Non-proliferative glomerulonephritis', 'Nephrotic syndrome without mention of glomerulonephritis', 'Renal failure', 'Renal failure NOS', 'Chronic renal failure [CKD]', 'Chronic Kidney Disease, Stage III', 'Chronic Kidney Disease, Stage IV', 'Chronic kidney disease, Stage I or II', 'Kidney replaced by transpant', 'Disorders resulting from impaired renal function', 'Renal osteodystrophy', 'Urethral stricture (not specified as infectious)', 'Uterine/Uterovaginal prolapse', 'Lupus (localized and systemic)', 'Systemic lupus erythematosus', 'Sarcoidosis', 'Diffuse diseases of connective tissue', 'Sicca syndrome', 'Polymyositis', 'Dermatomyositis', 'Rheumatoid arthritis and other inflammatory polyarthropathies', 'Rheumatoid arthritis', 'Contracture of tendon (sheath)', 'Malunion and nonunion of fracture', 'Hammer toe (acquired)', 'Stress fracture', 'Congenital anomalies of peripheral vascular system', 'Other congenital musculoskeletal anomalies', 'Thoracic or lumbosacral neuritis or radiculitis, unspecified', 'Muscular wasting and disuse atrophy', 'Rhabdomyolysis', 'Facial weakness', 'Complications of transplants and reattached limbs', 'Bone marrow or stem cell transplant', 'Atopic/contact dermatitis due to other or unspecified']",2
